[
  {
    "source": "Insurance Europe News",
    "title": "Consumer Hub updated with new examples of consumer-focused insurance practices across Europe",
    "date": "6-1-2026",
    "sortDate": "2026-06-01T12:00:00.000Z",
    "summary": "",
    "link": "https://www.insuranceeurope.eu/news/3492/consumer-hub-updated-with-new-examples-of-consumer-focused-insurance-practices-across-europe"
  },
  {
    "source": "BaFin Aktuelles",
    "title": "Di­gi­ta­les Auf­sichts­brie­fing am 05.02.2026",
    "date": "03.02.2026",
    "sortDate": "2026-03-02T12:00:00.000Z",
    "summary": "",
    "link": "https://www.bafin.de/SharedDocs/Veroeffentlichungen/DE/Meldung/2026/neu/meldung_2026_02_03_digitales_aufsichtsbriefing_2026.html?cms_expanded=true"
  },
  {
    "source": "BaFin Aktuelles",
    "title": "Fi­nanz­be­richt­er­stat­tung: Bun­des­amt für Jus­tiz ver­hängt Ord­nungs­geld ge­gen die Gate­way Re­al Estate AG",
    "date": "03.02.2026",
    "sortDate": "2026-03-02T12:00:00.000Z",
    "summary": "",
    "link": "https://www.bafin.de/SharedDocs/Veroeffentlichungen/DE/Massnahmen/40c_neu_124_WpHG/neu/meldung_2026_02_03_gateway_real_estate_ag_1.html?cms_expanded=true"
  },
  {
    "source": "BaFin Aktuelles",
    "title": "re­va­lo­nin­vest(.)de: Ba­Fin warnt vor Web­si­te",
    "date": "03.02.2026",
    "sortDate": "2026-03-02T12:00:00.000Z",
    "summary": "",
    "link": "https://www.bafin.de/SharedDocs/Veroeffentlichungen/DE/Verbrauchermitteilung/unerlaubte/2026/neu/meldung_2026_02_03_revaloninvest.html?cms_expanded=true"
  },
  {
    "source": "BaFin Aktuelles",
    "title": "cen­ter­view­pn(.)com: Ba­Fin er­mit­telt ge­gen die Be­trei­ber der Web­si­te",
    "date": "",
    "sortDate": "2026-02-04T04:31:43.504Z",
    "summary": "",
    "link": "https://www.bafin.de/SharedDocs/Veroeffentlichungen/DE/Verbrauchermitteilung/unerlaubte/2026/neu/meldung_2026_02_02_centerviewpn.html?cms_expanded=true"
  },
  {
    "source": "BaFin Aktuelles",
    "title": "we­fi(.)co: Ba­Fin warnt vor Web­si­te",
    "date": "",
    "sortDate": "2026-02-04T04:31:43.503Z",
    "summary": "",
    "link": "https://www.bafin.de/SharedDocs/Veroeffentlichungen/DE/Verbrauchermitteilung/unerlaubte/2026/neu/meldung_2026_02_03_wefi_co.html?cms_expanded=true"
  },
  {
    "source": "BaFin Aktuelles",
    "title": "Ba­Fin-Schlich­tungs­stel­le: Zahl der Be­schwer­den ge­stie­gen",
    "date": "",
    "sortDate": "2026-02-04T04:31:43.503Z",
    "summary": "",
    "link": "https://www.bafin.de/SharedDocs/Veroeffentlichungen/DE/Meldung/2026/neu/meldung_2026_02_02_bafin_schlichterbericht_2025.html?cms_expanded=true"
  },
  {
    "source": "BaFin Aktuelles",
    "title": "Die Fi­nan­z­auf­sicht Ba­Fin warnt vor An­ge­bo­ten von Ver­to",
    "date": "",
    "sortDate": "2026-02-04T04:31:43.503Z",
    "summary": "",
    "link": "https://www.bafin.de/SharedDocs/Veroeffentlichungen/DE/Verbrauchermitteilung/unerlaubte/2026/neu/meldung_2026_02_02_verto.html?cms_expanded=true"
  },
  {
    "source": "BaFin Aktuelles",
    "title": "Fi­nanz­be­richt­er­stat­tung: Bun­des­amt für Jus­tiz ver­hängt Ord­nungs­geld ge­gen die Gate­way Re­al Estate AG",
    "date": "",
    "sortDate": "2026-02-04T04:31:43.502Z",
    "summary": "",
    "link": "https://www.bafin.de/SharedDocs/Veroeffentlichungen/DE/Massnahmen/40c_neu_124_WpHG/neu/meldung_2026_02_03_gateway_real_estate_ag_2.html?cms_expanded=true"
  },
  {
    "source": "SCOR Press & News",
    "title": "SCOR and AXA Join Forces to Launch Lloyd’s Consortium for Ecological Restoration Insurance",
    "date": "",
    "sortDate": "2026-02-04T04:31:41.990Z",
    "summary": "",
    "link": "https://www.scor.com/en/news/scor-and-axa-join-forces-launch-lloyds-consortium-ecological-restoration-insurance"
  },
  {
    "source": "Gallagher Re News & Insights",
    "title": "North American Surety — 1.1.2026 Renewal Recap and Summary",
    "date": "3 February 2026",
    "sortDate": "2026-02-03T12:00:00.000Z",
    "summary": "",
    "link": "https://www.ajg.com/gallagherre/news-and-insights/north-america-surety-first-january-2026-renewal-recap-and-summary/"
  },
  {
    "source": "Chubb News Releases",
    "title": "Chubb Reports Fourth Quarter Net Income of $3.21 Billion, Up 24.7%, and Core Operating Income of $2.98 Billion, Up 21.7%; Consolidated Net Premiums Written of $13.1 Billion, Up 8.9%, with P&C and Life Insurance Up 7.7% and 16.9%; Record P&C Combined Ratio of 81.2%; Full-Year Record Net Income of $10.31 Billion, Up 11.2%, and Record Core Operating Income of $9.95 Billion, Up 8.9%; Consolidated Net Premiums Written of $54.8 Billion, Up 6.6%, with P&C and Life Insurance Up 5.4% and 15.1%; Record P&C Combined Ratio of 85.7%",
    "date": "Feb 3, 2026",
    "sortDate": "2026-02-03T12:00:00.000Z",
    "summary": "",
    "link": "https://news.chubb.com/2026-02-03-Chubb-Reports-Fourth-Quarter-Net-Income-of-3-21-Billion,-Up-24-7-,-and-Core-Operating-Income-of-2-98-Billion,-Up-21-7-Consolidated-Net-Premiums-Written-of-13-1-Billion,-Up-8-9-,-with-P-C-and-Life-Insurance-Up-7-7-and-16-9-Record-P-C-Combined-Ra"
  },
  {
    "source": "FCA News",
    "title": "Upper Tribunal finds that Banque Havilland devised a plan to harm the Qatari economy",
    "date": "03/02/2026",
    "sortDate": "2026-02-03T00:00:00.000Z",
    "summary": "",
    "link": "https://www.fca.org.uk/news/press-releases/upper-tribunal-banque-havilland-plan-harm-qatari-economy"
  },
  {
    "source": "FCA News",
    "title": "Insurance in the round: Innovation, growth and trust",
    "date": "03/02/2026",
    "sortDate": "2026-02-03T00:00:00.000Z",
    "summary": "",
    "link": "https://www.fca.org.uk/news/speeches/insurance-round-innovation-growth-and-trust"
  },
  {
    "source": "FCA News",
    "title": "Regulators announce first firms to join Scale-up Unit",
    "date": "03/02/2026",
    "sortDate": "2026-02-03T00:00:00.000Z",
    "summary": "",
    "link": "https://www.fca.org.uk/news/press-releases/regulators-announce-first-firms-join-scale-unit"
  },
  {
    "source": "FCA News",
    "title": "Falling cost of premium finance saving consumers around £157m a year",
    "date": "03/02/2026",
    "sortDate": "2026-02-03T00:00:00.000Z",
    "summary": "",
    "link": "https://www.fca.org.uk/news/press-releases/falling-cost-premium-finance-saving-consumers-around-157m-year"
  },
  {
    "source": "FCA News",
    "title": "What do we mean when we say 'fair value'?",
    "date": "03/02/2026",
    "sortDate": "2026-02-03T00:00:00.000Z",
    "summary": "",
    "link": "https://www.fca.org.uk/news/blogs/what-do-we-mean-when-we-say-fair-value"
  },
  {
    "source": "ABI News",
    "title": "ABI outlines strategy to strengthen trust, resilience and market effectiveness",
    "date": "03/02/2026",
    "sortDate": "2026-02-03T00:00:00.000Z",
    "summary": "In its new 2026-28 strategy, the ABI reaffirms its commitment to building a trusted sector, investing in people and planet and shaping an effective market.Following a successful three-year period…",
    "link": "https://www.abi.org.uk/news/news-articles/2026/2/abi-outlines-strategy-to-strengthen-trust-resilience-and-market-effectiveness/"
  },
  {
    "source": "Gallagher Re News & Insights",
    "title": "The Facultative View: Global Facultative Market Report",
    "date": "2 February 2026",
    "sortDate": "2026-02-02T12:00:00.000Z",
    "summary": "",
    "link": "https://www.ajg.com/gallagherre/news-and-insights/the-facultative-view-global-facultative-market-report/"
  },
  {
    "source": "AXA XL Press Releases",
    "title": "AXA XL middle market growth continues with key hire in the East and expansion West",
    "date": "February 2, 2026",
    "sortDate": "2026-02-02T12:00:00.000Z",
    "summary": "Ainsley Keating has joined AXA XL as Head of the East Region for General Industries, Mid-Market, Americas.\nReporting to Adele Smith, Head of General Industries and Excess Casualty—U.S. Mid-Market,...",
    "link": "https://axaxl.com/press-releases/axa-xl-middle-market-growth-continues-with-key-hire-in-the-east-and-expansion-west"
  },
  {
    "source": "BaFin Aktuelles",
    "title": "Sa­ve the Da­te: Ka­pi­tal­markt­kon­fe­renz 2026",
    "date": "02.02.2026",
    "sortDate": "2026-02-02T12:00:00.000Z",
    "summary": "",
    "link": "https://www.bafin.de/SharedDocs/Veroeffentlichungen/DE/Meldung/2026/neu/meldung_2026_02_02_save-the-date_kapitalmarktkonferenz_2026.html?cms_expanded=true"
  },
  {
    "source": "BaFin Aktuelles",
    "title": "PCAM: Ba­Fin warnt vor An­ge­bo­ten auf der Web­si­te pc-as­set-ma­nage­ment[.]com, in der App „PCAU pro“ und in den Whats­App-Grup­pen",
    "date": "02.02.2026",
    "sortDate": "2026-02-02T12:00:00.000Z",
    "summary": "",
    "link": "https://www.bafin.de/SharedDocs/Veroeffentlichungen/DE/Verbrauchermitteilung/unerlaubte/2026/neu/meldung_2026_02_02_pc-asset-management.html?cms_expanded=true"
  },
  {
    "source": "FCA News",
    "title": "The role of the FCA and PSR in delivering the National Payments Vision",
    "date": "02/02/2026",
    "sortDate": "2026-02-02T00:00:00.000Z",
    "summary": "",
    "link": "https://www.fca.org.uk/news/speeches/role-fca-and-psr-delivering-national-payments-vision"
  },
  {
    "source": "SCOR Press & News",
    "title": "SCOR strengthens cyber capabilities by partnering with Baobab Insurance",
    "date": "January 30, 2026",
    "sortDate": "2026-01-30T12:00:00.000Z",
    "summary": "",
    "link": "https://www.scor.com/en/news/scor-strengthens-cyber-capabilities-partnering-baobab-insurance"
  },
  {
    "source": "Gallagher Re News & Insights",
    "title": "Gallagher Re Cyber Risk Adjusted Rating (RAR) Index: 2026 update",
    "date": "30 January 2026",
    "sortDate": "2026-01-30T12:00:00.000Z",
    "summary": "",
    "link": "https://www.ajg.com/gallagherre/news-and-insights/gallagherre-cyber-risk-adjusted-rating-rar-index-2026-update/"
  },
  {
    "source": "FCA News",
    "title": "The FCA’s long term review into AI and retail financial services: designing for the unknown",
    "date": "30/01/2026",
    "sortDate": "2026-01-30T00:00:00.000Z",
    "summary": "",
    "link": "https://www.fca.org.uk/news/speeches/fca-long-term-review-ai-retail-financial-services-designing-unknown"
  },
  {
    "source": "FCA News",
    "title": "AI Live Testing: How it can support safe and responsible AI deployment",
    "date": "30/01/2026",
    "sortDate": "2026-01-30T00:00:00.000Z",
    "summary": "",
    "link": "https://www.fca.org.uk/news/blogs/ai-live-testing-how-it-can-support-safe-and-responsible-ai-deployment"
  },
  {
    "source": "ABI News",
    "title": "L&G joins the ABI",
    "date": "30/01/2026",
    "sortDate": "2026-01-30T00:00:00.000Z",
    "summary": "L&G has become a member of the ABI, the voice of the UK’s world-leading insurance and long-term savings industry.\nEstablished in 1836, L&G is one of the UK's leading financial services…",
    "link": "https://www.abi.org.uk/news/news-articles/2026/1/lg-joins-the-abi/"
  },
  {
    "source": "Howden Re News",
    "title": "Howden Re’s Construction outlook at 1.1.2026",
    "date": "29 January 2026",
    "sortDate": "2026-01-29T12:00:00.000Z",
    "summary": "",
    "link": "https://www.howdenre.com/news-insights/howden-res-construction-outlook-112026"
  },
  {
    "source": "AXA XL Press Releases",
    "title": "AXA XL adds new coverages to protect lenders from pollution and remediation legal liability",
    "date": "January 29, 2026",
    "sortDate": "2026-01-29T12:00:00.000Z",
    "summary": "AXA XL has added new coverages to its pollution and remediation liability insurance for lenders, further protecting them from losses in the event of a loan default.\nThe Protective Environmental Asset Coverage...",
    "link": "https://axaxl.com/press-releases/axa-xl-adds-new-coverages-to-protect-lenders-from-pollution-and-remediation-legal-liability"
  },
  {
    "source": "FCA News",
    "title": "Emil the Seal hijacks Waterloo station to warn commuters about investment scams",
    "date": "29/01/2026",
    "sortDate": "2026-01-29T00:00:00.000Z",
    "summary": "",
    "link": "https://www.fca.org.uk/news/press-releases/emil-seal-hijacks-waterloo-station-warn-commuters-investment-scams"
  },
  {
    "source": "FCA News",
    "title": "FCA seeks views on how to help close the protection gap",
    "date": "29/01/2026",
    "sortDate": "2026-01-29T00:00:00.000Z",
    "summary": "",
    "link": "https://www.fca.org.uk/news/press-releases/fca-seeks-views-close-protection-gap"
  },
  {
    "source": "ABI News",
    "title": "Power to the industry: The ABI strengthens member decision-making",
    "date": "29/01/2026",
    "sortDate": "2026-01-29T00:00:00.000Z",
    "summary": "The ABI has refreshed its governance structure to give greater decision-making to the lead committees for general insurance, long-term savings and health and protection. Now known as product boards, the groups will determine all policy matters in the markets they represent.",
    "link": "https://www.abi.org.uk/news/news-articles/2026/1/power-to-the-industry-the-abi-strengthens-member-decision-making/"
  },
  {
    "source": "ABI News",
    "title": "New guide to help SMEs navigate insurance needs",
    "date": "29/01/2026",
    "sortDate": "2026-01-29T00:00:00.000Z",
    "summary": "A new guide from the ABI aims to help the UK’s Small and Medium-sized Enterprises (SMEs) better understand their insurance needs and address gaps in coverage. The guide breaks down the different insurance products and requirements for SMEs, which represent 99% of UK businesses.",
    "link": "https://www.abi.org.uk/news/news-articles/2026/1/new-guide-to-help-smes-navigate-insurance-needs/"
  },
  {
    "source": "Swiss Re Sigma",
    "title": "Structural tailwinds meet cyclical headwinds: a new phase for the US surplus lines market",
    "date": "28  Jan  2026",
    "sortDate": "2026-01-28T12:00:00.000Z",
    "summary": "The US E&S insurance market is set to grow more slowly than the admitted segment for the first time in nearly a decade.",
    "link": "https://sigma.swissre.com/short-insights/structural-tailwinds-meet-cyclical-headwinds-new-phase-us-surplus-lines-market"
  },
  {
    "source": "AXA XL Press Releases",
    "title": "AXA XL Appoints Jason Billingslea as Head of Energy, E&S",
    "date": "January 28, 2026",
    "sortDate": "2026-01-28T12:00:00.000Z",
    "summary": "AXA XL has appointed Jason C. Billingslea as Head of Energy, E&S, where he will lead the development and growth of the energy sector team. His focus will be on expanding the portfolio, strengthening...",
    "link": "https://axaxl.com/press-releases/axa-xl-appoints-jason-billingslea-as-head-of-energy-eands"
  },
  {
    "source": "Howden Re News",
    "title": "Howden Re’s Aviation outlook at 1.1.2026",
    "date": "26 January 2026",
    "sortDate": "2026-01-26T12:00:00.000Z",
    "summary": "",
    "link": "https://www.howdenre.com/news-insights/howden-res-aviation-outlook-112026"
  },
  {
    "source": "Insurance Europe News",
    "title": "New safety updates: E‑Scooter rules revised in Bulgaria, Italy and Finland",
    "date": "26-1-2026",
    "sortDate": "2026-01-26T12:00:00.000Z",
    "summary": "",
    "link": "https://www.insuranceeurope.eu/news/3495/new-safety-updates-e-scooter-rules-revised-in-bulgaria-italy-and-finland"
  },
  {
    "source": "Howden Re News",
    "title": "German reinsurance market sees more measured pricing shifts",
    "date": "23 January 2026",
    "sortDate": "2026-01-23T12:00:00.000Z",
    "summary": "",
    "link": "https://www.howdenre.com/news-insights/german-reinsurance-market-sees-more-measured-pricing-shifts"
  },
  {
    "source": "Howden Re News",
    "title": "Howden Re’s Credit and Political Risk Insurance outlook at 1.1.2026",
    "date": "22 January 2026",
    "sortDate": "2026-01-22T12:00:00.000Z",
    "summary": "",
    "link": "https://www.howdenre.com/news-insights/howden-res-credit-and-political-risk-insurance-outlook-112026"
  },
  {
    "source": "AXA XL Press Releases",
    "title": "AXA XL creates dedicated Alternative Risk Solutions (ARS) team in the Americas; Names Sylvain Bouteillé, Specialty CUO, to lead",
    "date": "January 22, 2026",
    "sortDate": "2026-01-22T12:00:00.000Z",
    "summary": "AXA XL has launched a dedicated Alternative Risk Solutions (ARS) team, appointing Sylvain Bouteillé, current Chief Underwriting Officer, Specialty as its leader. The new team centralizes AXA XL’s...",
    "link": "https://axaxl.com/press-releases/axa-xl-creates-dedicated-alternative-risk-solutions-team-in-the-americas"
  },
  {
    "source": "AXA XL Press Releases",
    "title": "AXA XL appoints Samantha Hazlewood to strategic global client management role",
    "date": "January 22, 2026",
    "sortDate": "2026-01-22T12:00:00.000Z",
    "summary": "AXA XL today announced the appointment of Samantha Hazlewood as Head of AXA Group Partnerships and Strategic Client Management for AXA XL, effective February 1st.\nIn this new role, Ms. Hazlewood will oversee...",
    "link": "https://axaxl.com/press-releases/axa-xl-appoints-samantha-hazlewood-to-strategic-global-client-management-role"
  },
  {
    "source": "Howden Re News",
    "title": "Howden Re launches its H2 2025 Cyber Threat Report: Analysis of cyber threat trends shaping the risk landscape",
    "date": "21 January 2026",
    "sortDate": "2026-01-21T12:00:00.000Z",
    "summary": "",
    "link": "https://www.howdenre.com/news-insights/howden-re-launches-its-h2-2025-cyber-threat-report-analysis-cyber-threat-trends-shaping-risk"
  },
  {
    "source": "Gallagher Re News & Insights",
    "title": "Gallagher Re Natural Catastrophe and Climate Report 2025",
    "date": "21 January 2026",
    "sortDate": "2026-01-21T12:00:00.000Z",
    "summary": "",
    "link": "https://www.ajg.com/gallagherre/news-and-insights/gallagherre-natural-catastrophe-and-climate-report-2025/"
  },
  {
    "source": "Insurance Europe News",
    "title": "Insurance Europe co-signs cross-sector call for EU action on Third-Party Litigation Funding (TPLF)",
    "date": "21-1-2026",
    "sortDate": "2026-01-21T12:00:00.000Z",
    "summary": "",
    "link": "https://www.insuranceeurope.eu/news/3491/insurance-europe-co-signs-cross-sector-call-for-eu-action-on-third-party-litigation-funding-tplf"
  },
  {
    "source": "Swiss Re Sigma",
    "title": "US Property & Casualty Outlook: soft market, or soft landing?",
    "date": "20  Jan  2026",
    "sortDate": "2026-01-20T12:00:00.000Z",
    "summary": "US P&C premium growth and profitability are moderating as the market enters 2026, following an exceptionally strong 2025 underpinned by solid underwriting performance.",
    "link": "https://sigma.swissre.com/short-insights/us-property-casualty-outlook-soft-market-or-soft-landing"
  },
  {
    "source": "AXA XL Press Releases",
    "title": "AXA XL Appoints Liz Rychling as Head of Broker Relations, Large Commercial and Mid-Market",
    "date": "January 20, 2026",
    "sortDate": "2026-01-20T12:00:00.000Z",
    "summary": "AXA XL has appointed Liz Rychling as Head of Broker Relations, Large Commercial and Mid-Market, in its Americas region.  Based in New York, she reports to Matt O’Malley, Chief Client and Distribution...",
    "link": "https://axaxl.com/press-releases/axa-xl-appoints-liz-rychling-as-head-of-broker-relations-large-commercial-and-mid-market"
  },
  {
    "source": "Swiss Re Sigma",
    "title": "India's economic and insurance market outlook 2026-2030",
    "date": "19  Jan  2026",
    "sortDate": "2026-01-19T12:00:00.000Z",
    "summary": "India's economic resilience, rooted in strong macro buffers and reform momentum place it well to navigate global uncertainty and sustain medium-term growth momentum.",
    "link": "https://sigma.swissre.com/expertise-publications/india-economic-and-insurance-market-outlook"
  },
  {
    "source": "Howden Re News",
    "title": "Howden Re’s Cyber outlook at 1.1.2026",
    "date": "19 January 2026",
    "sortDate": "2026-01-19T12:00:00.000Z",
    "summary": "",
    "link": "https://www.howdenre.com/news-insights/howden-res-cyber-outlook-112026"
  },
  {
    "source": "SCOR Press & News",
    "title": "SCOR supports major new fully integrated insurance facility for AI infrastructure",
    "date": "January 16, 2026",
    "sortDate": "2026-01-16T12:00:00.000Z",
    "summary": "",
    "link": "https://www.scor.com/en/news/scor-supports-major-new-fully-integrated-insurance-facility-ai-infrastructure"
  },
  {
    "source": "Howden Re News",
    "title": "January 1 renewals highlight evolving conditions in Iberia",
    "date": "16 January 2026",
    "sortDate": "2026-01-16T12:00:00.000Z",
    "summary": "",
    "link": "https://www.howdenre.com/news-insights/january-1-renewals-highlight-evolving-conditions-iberia"
  },
  {
    "source": "Swiss Re Sigma",
    "title": "Economic and financial market risk insights - January 2026",
    "date": "15  Jan  2026",
    "sortDate": "2026-01-15T12:00:00.000Z",
    "summary": "We forecast solid global real GDP growth in 2026, with upside to our forecasts for key markets.",
    "link": "https://sigma.swissre.com/economic-outlook/economic-and-financial-market-risk-insights-january-2026"
  },
  {
    "source": "Howden Re News",
    "title": "Howden Re Fac expands DACH team with two senior appointments in Germany",
    "date": "15 January 2026",
    "sortDate": "2026-01-15T12:00:00.000Z",
    "summary": "",
    "link": "https://www.howdenre.com/news-insights/howden-re-fac-expands-dach-team-two-senior-appointments-germany"
  },
  {
    "source": "SCOR Press & News",
    "title": "SCOR announces changes to its  Group Executive Committee",
    "date": "January 14, 2026 — 07:30",
    "sortDate": "2026-01-14T12:00:00.000Z",
    "summary": "",
    "link": "https://www.scor.com/en/press-release/scor-announces-changes-its-group-executive-committee-0"
  },
  {
    "source": "Howden Re News",
    "title": "Howden Re Inspire – meet Brian Turner",
    "date": "14 January 2026",
    "sortDate": "2026-01-14T12:00:00.000Z",
    "summary": "",
    "link": "https://www.howdenre.com/news-insights/howden-re-inspire-meet-brian-turner"
  },
  {
    "source": "AXA XL Press Releases",
    "title": "AXA XL Reinsurance promotes Julian Longbottom to Global Head of Marine & Energy, Reinsurance and Jamie Pedro to Head of Specialty, Reinsurance, Bermuda.",
    "date": "January 14, 2026",
    "sortDate": "2026-01-14T12:00:00.000Z",
    "summary": "AXA XL Reinsurance has today announced it has promoted Julian Longbottom to Global Head of Marine & Energy, Reinsurance and Jamie Pedro to Head of Specialty, Reinsurance, Bermuda effective 1 January...",
    "link": "https://axaxl.com/press-releases/axa-xl-reinsurance-promotes-julian-longbottom-and-jamie-pedro"
  },
  {
    "source": "SCOR Press & News",
    "title": "\"Make your mark. Act for Society\"",
    "date": "January 13, 2026 — 11:28",
    "sortDate": "2026-01-13T12:00:00.000Z",
    "summary": "",
    "link": "https://www.scor.com/en/news/make-your-mark-act-society"
  },
  {
    "source": "Gallagher Re News & Insights",
    "title": "California Wildfire: Navigating Risk and Finding Opportunity",
    "date": "13 January 2026",
    "sortDate": "2026-01-13T12:00:00.000Z",
    "summary": "",
    "link": "https://www.ajg.com/gallagherre/news-and-insights/california-wildfire-navigating-risk-and-finding-opportunity/"
  },
  {
    "source": "SCOR Press & News",
    "title": "SCOR Global Reinsurance Ireland dac becomes SCOR Global Reinsurance France SA",
    "date": "January 8, 2026 — 17:30",
    "sortDate": "2026-01-08T12:00:00.000Z",
    "summary": "",
    "link": "https://www.scor.com/en/press-release/scor-global-reinsurance-ireland-dac-becomes-scor-global-reinsurance-france-sa"
  },
  {
    "source": "Chubb News Releases",
    "title": "Chubb Limited to Hold its Fourth Quarter Earnings Conference Call on Wednesday, February 4, 2026",
    "date": "Jan 8, 2026",
    "sortDate": "2026-01-08T12:00:00.000Z",
    "summary": "",
    "link": "https://news.chubb.com/2026-01-08-Chubb-Limited-to-Hold-its-Fourth-Quarter-Earnings-Conference-Call-on-Wednesday,-February-4,-2026"
  },
  {
    "source": "AXA XL Press Releases",
    "title": "AXA XL promotes Matthew Stitham to Chief Underwriting Officer, Casualty in the Americas",
    "date": "January 8, 2026",
    "sortDate": "2026-01-08T12:00:00.000Z",
    "summary": "AXA XL has promoted Matthew Stitham to Chief Underwriting Officer, Casualty in the Americas.  Based in San Francisco, Mr. Stitham reports to Donna Nadeau, AXA XL’s Head of Large Commercial business. ...",
    "link": "https://axaxl.com/press-releases/axa-xl-promotes-matthew-stitham-to-chief-underwriting-officer-casualty-in-the-americas"
  },
  {
    "source": "Chubb News Releases",
    "title": "Chubb Appoints Jimaan Sané to Head of Growth, Global Cyber",
    "date": "Jan 7, 2026",
    "sortDate": "2026-01-07T12:00:00.000Z",
    "summary": "",
    "link": "https://news.chubb.com/2026-01-07-Chubb-Appoints-Jimaan-Sane-to-Head-of-Growth,-Global-Cyber"
  },
  {
    "source": "Chubb News Releases",
    "title": "Combined Insurance Unveils New Chubb Benefits Brand",
    "date": "Jan 5, 2026",
    "sortDate": "2026-01-05T12:00:00.000Z",
    "summary": "",
    "link": "https://news.chubb.com/2026-01-05-Combined-Insurance-Unveils-New-Chubb-Benefits-Brand"
  },
  {
    "source": "Gallagher Re News & Insights",
    "title": "First View: Options and Opportunities",
    "date": "2 January 2026",
    "sortDate": "2026-01-02T12:00:00.000Z",
    "summary": "",
    "link": "https://www.ajg.com/gallagherre/news-and-insights/first-view-options-and-opportunities/"
  },
  {
    "source": "Chubb News Releases",
    "title": "Healthy Paws Pet Foundation at Chubb Donates $275,000 to Animal Rescue Organizations Across the United States to Support Adoption and Ongoing Care for Vulnerable Pets",
    "date": "Dec 22, 2025",
    "sortDate": "2025-12-22T12:00:00.000Z",
    "summary": "",
    "link": "https://news.chubb.com/2025-12-22-Healthy-Paws-Pet-Foundation-at-Chubb-Donates-275,000-to-Animal-Rescue-Organizations-Across-the-United-States-to-Support-Adoption-and-Ongoing-Care-for-Vulnerable-Pets"
  },
  {
    "source": "SCOR Press & News",
    "title": "SCOR renews its contingent capital program",
    "date": "December 18, 2025 — 17:40",
    "sortDate": "2025-12-18T12:00:00.000Z",
    "summary": "",
    "link": "https://www.scor.com/en/press-release/scor-renews-its-contingent-capital-program"
  },
  {
    "source": "AXA XL Press Releases",
    "title": "AXA XL Appoints Jeffrey L. Loop as Head of Media Liability",
    "date": "December 18, 2025",
    "sortDate": "2025-12-18T12:00:00.000Z",
    "summary": "To help its clients address rising media liability risks, AXA XL has appointed Jeffrey L. Loop as the new Head of Media Liability.  Based in Los Angeles, Mr. Loop reports to Michelle Chia, Chief Underwriting...",
    "link": "https://axaxl.com/press-releases/axa-xl-appoints-jeffrey-l-loop-as-head-of-media-liability"
  },
  {
    "source": "Insurance Europe News",
    "title": "EU Retail Investment Strategy: A step forward, but avoiding extra complexity is key",
    "date": "18-12-2025",
    "sortDate": "2025-12-18T12:00:00.000Z",
    "summary": "",
    "link": "https://www.insuranceeurope.eu/news/3479/eu-retail-investment-strategy-a-step-forward-but-avoiding-extra-complexity-is-key"
  },
  {
    "source": "SCOR Press & News",
    "title": "SCOR’s Actuarial Awards reward outstanding research across six countries in 2025",
    "date": "December 15, 2025 — 16:30",
    "sortDate": "2025-12-15T12:00:00.000Z",
    "summary": "",
    "link": "https://www.scor.com/en/press-release/scors-actuarial-awards-reward-outstanding-research-across-six-countries-2025"
  },
  {
    "source": "Geneva Association News",
    "title": "Insurance as a Core Element of Financial Inclusion in Emerging Economies | Key messages",
    "date": "Dec 11, 2025",
    "sortDate": "2025-12-11T12:00:00.000Z",
    "summary": "",
    "link": "https://www.genevaassociation.org/videos/insurance-core-element-financial-inclusion-emerging-economies-key-messages"
  },
  {
    "source": "SCOR Press & News",
    "title": "Supporting the Energy Transition through Carbon Capture and Sequestration/Storage",
    "date": "December 9, 2025 — 12:40",
    "sortDate": "2025-12-09T12:00:00.000Z",
    "summary": "",
    "link": "https://www.scor.com/en/news/supporting-energy-transition-through-carbon-capture-and-sequestrationstorage"
  },
  {
    "source": "Gallagher Re News & Insights",
    "title": "Mortgage Market Report Q4 2025",
    "date": "4 December 2025",
    "sortDate": "2025-12-04T12:00:00.000Z",
    "summary": "",
    "link": "https://www.ajg.com/gallagherre/news-and-insights/mortgage-market-report-q4-2025/"
  },
  {
    "source": "Geneva Association News",
    "title": "As medical costs top financial worries in emerging markets, insurers strive to build more affordable cover, says Geneva Association",
    "date": "Dec 04, 2025",
    "sortDate": "2025-12-04T12:00:00.000Z",
    "summary": "",
    "link": "https://www.genevaassociation.org/press-releases/medical-costs-top-financial-worries-emerging-markets-insurers-strive-build-more"
  },
  {
    "source": "AXA XL Press Releases",
    "title": "AXA XL appoints Sylvain Eyraud as Country Manager, Italy",
    "date": "November 28, 2025",
    "sortDate": "2025-11-28T12:00:00.000Z",
    "summary": "AXA XL today announced the appointment of Sylvain Eyraud as Country Manager, Italy, effective January 1, subject to regulatory approval. He will succeed Saverio Longo who will be leaving AXA XL to pursue...",
    "link": "https://axaxl.com/press-releases/axa-xl-appoints-sylvain-eyraud-as-country-manager-italy"
  },
  {
    "source": "Geneva Association News",
    "title": "Gen AI in the Insurance Customer Journey | Key messages",
    "date": "Nov 26, 2025",
    "sortDate": "2025-11-26T12:00:00.000Z",
    "summary": "",
    "link": "https://www.genevaassociation.org/videos/gen-ai-insurance-customer-journey-key-messages"
  },
  {
    "source": "Insurance Europe News",
    "title": "2025 Pension Survey: Europe’s pension gap persists as new survey shows four in ten still not saving",
    "date": "25-11-2025",
    "sortDate": "2025-11-25T12:00:00.000Z",
    "summary": "",
    "link": "https://www.insuranceeurope.eu/news/3473/2025-pension-survey-europe-s-pension-gap-persists-as-new-survey-shows-four-in-ten-still-not-saving"
  },
  {
    "source": "Insurance Europe News",
    "title": "New EU Supplementary Pensions Package: milestone for retirement resilience and investment",
    "date": "20-11-2025",
    "sortDate": "2025-11-20T12:00:00.000Z",
    "summary": "",
    "link": "https://www.insuranceeurope.eu/news/3469/new-eu-supplementary-pensions-package-milestone-for-retirement-resilience-and-investment"
  },
  {
    "source": "Geneva Association News",
    "title": "Insurance customers want both Gen AI efficiency and human empathy, finds new Geneva Association report",
    "date": "Nov 20, 2025",
    "sortDate": "2025-11-20T12:00:00.000Z",
    "summary": "",
    "link": "https://www.genevaassociation.org/press-releases/insurance-customers-want-both-gen-ai-efficiency-and-human-empathy-finds-new-geneva"
  },
  {
    "source": "Insurance Europe News",
    "title": "Clearer digital rules needed to support innovation and resilience in Europe’s insurance sector",
    "date": "19-11-2025",
    "sortDate": "2025-11-19T12:00:00.000Z",
    "summary": "",
    "link": "https://www.insuranceeurope.eu/news/3468/clearer-digital-rules-needed-to-support-innovation-and-resilience-in-europe-s-insurance-sector"
  },
  {
    "source": "Gallagher Re News & Insights",
    "title": "Global InsurTech Report for Q3 2025",
    "date": "6 November 2025",
    "sortDate": "2025-11-06T12:00:00.000Z",
    "summary": "",
    "link": "https://www.ajg.com/gallagherre/news-and-insights/global-insurtech-report-q3-2025/"
  },
  {
    "source": "SCOR Press & News",
    "title": "SCOR at FIDES 2025: Driving Innovation and Sustainability in Latin America",
    "date": "November 5, 2025 — 17:53",
    "sortDate": "2025-11-05T12:00:00.000Z",
    "summary": "",
    "link": "https://www.scor.com/en/news/scor-fides-2025-driving-innovation-and-sustainability-latin-america"
  },
  {
    "source": "Gallagher Re News & Insights",
    "title": "Smooth the Spikes with Structured Solutions",
    "date": "3 November 2025",
    "sortDate": "2025-11-03T12:00:00.000Z",
    "summary": "",
    "link": "https://www.ajg.com/gallagherre/news-and-insights/smooth-the-spikes-with-structured-solutions/"
  },
  {
    "source": "SCOR Press & News",
    "title": "Third quarter 2025 results",
    "date": "October 31, 2025 — 07:00",
    "sortDate": "2025-10-31T12:00:00.000Z",
    "summary": "",
    "link": "https://www.scor.com/en/press-release/third-quarter-2025-results"
  },
  {
    "source": "Insurance Europe News",
    "title": "Proposed amendments to Solvency II rules improve conditions for investment and competitiveness",
    "date": "30-10-2025",
    "sortDate": "2025-10-30T12:00:00.000Z",
    "summary": "",
    "link": "https://www.insuranceeurope.eu/news/3464/proposed-amendments-to-solvency-ii-rules-improve-conditions-for-investment-and-competitiveness"
  },
  {
    "source": "SCOR Press & News",
    "title": "SCOR is proud to be a key contributor to the IDF’s Infrastructure Resilience Development Fund (IRDF)",
    "date": "October 28, 2025 — 14:39",
    "sortDate": "2025-10-28T12:00:00.000Z",
    "summary": "",
    "link": "https://www.scor.com/en/news/scor-proud-be-key-contributor-idfs-infrastructure-resilience-development-fund-irdf"
  },
  {
    "source": "Geneva Association News",
    "title": "Gen AI Risks for Businesses | Key messages",
    "date": "Oct 17, 2025",
    "sortDate": "2025-10-17T12:00:00.000Z",
    "summary": "",
    "link": "https://www.genevaassociation.org/videos/gen-ai-risks-businesses-key-messages"
  },
  {
    "source": "SCOR Press & News",
    "title": "Aktia launches SCOR’s Velogica in Finland, opening a new chapter in automated underwriting",
    "date": "October 2, 2025 — 12:05",
    "sortDate": "2025-10-02T12:00:00.000Z",
    "summary": "",
    "link": "https://www.scor.com/en/news/aktia-launches-scors-velogica-finland-opening-new-chapter-automated-underwriting"
  },
  {
    "source": "Geneva Association News",
    "title": "Nine in ten businesses show interest in insurance cover for Gen AI risks, new Geneva Association report shows",
    "date": "Oct 02, 2025",
    "sortDate": "2025-10-02T12:00:00.000Z",
    "summary": "",
    "link": "https://www.genevaassociation.org/press-releases/nine-ten-businesses-show-interest-insurance-cover-gen-ai-risks-new-geneva"
  },
  {
    "source": "SCOR Press & News",
    "title": "Information regarding the redemption by SCOR SE of outstanding €63.6 million undated subordinated notes",
    "date": "October 1, 2025 — 18:00",
    "sortDate": "2025-10-01T12:00:00.000Z",
    "summary": "",
    "link": "https://www.scor.com/en/press-release/information-regarding-redemption-scor-se-outstanding-eu636-million-undated"
  },
  {
    "source": "SCOR Press & News",
    "title": "Supporting the production of lithium, a key enabler of the energy transition",
    "date": "September 29, 2025 — 17:03",
    "sortDate": "2025-09-29T12:00:00.000Z",
    "summary": "",
    "link": "https://www.scor.com/en/news/supporting-production-lithium-key-enabler-energy-transition"
  },
  {
    "source": "SCOR Press & News",
    "title": "Results of the cash tender offer on subordinated notes",
    "date": "September 9, 2025 — 08:30",
    "sortDate": "2025-09-09T12:00:00.000Z",
    "summary": "",
    "link": "https://www.scor.com/en/press-release/results-cash-tender-offer-subordinated-notes"
  },
  {
    "source": "SCOR Press & News",
    "title": "SCOR successfully places EUR 500 million subordinated notes maturing in 2055",
    "date": "September 2, 2025 — 19:00",
    "sortDate": "2025-09-02T12:00:00.000Z",
    "summary": "",
    "link": "https://www.scor.com/en/press-release/scor-successfully-places-eur-500-million-subordinated-notes-maturing-2055"
  },
  {
    "source": "SCOR Press & News",
    "title": "SCOR announces the launch of a cash tender offer and its intention to issue new subordinated notes",
    "date": "September 2, 2025 — 08:30",
    "sortDate": "2025-09-02T12:00:00.000Z",
    "summary": "",
    "link": "https://www.scor.com/en/press-release/scor-announces-launch-cash-tender-offer-and-its-intention-issue-new-subordinated"
  },
  {
    "source": "Geneva Association News",
    "title": "The Geneva Association and Global Asia Insurance Partnership to Convene in Singapore to Turn Dialogue into Action on Risk Resilience",
    "date": "Aug 28, 2025",
    "sortDate": "2025-08-28T12:00:00.000Z",
    "summary": "",
    "link": "https://www.genevaassociation.org/press-releases/geneva-association-and-global-asia-insurance-partnership-convene-singapore-turn"
  },
  {
    "source": "SCOR Press & News",
    "title": "The timeline of the 2022 arbitration relating to retrocession treaties remains unchanged",
    "date": "August 13, 2025 — 20:00",
    "sortDate": "2025-08-13T12:00:00.000Z",
    "summary": "",
    "link": "https://www.scor.com/en/press-release/timeline-2022-arbitration-relating-retrocession-treaties-remains-unchanged"
  },
  {
    "source": "Geneva Association News",
    "title": "The Geneva Papers on Risk and Insurance achieves record journal impact factor of 3.3",
    "date": "Jul 08, 2025",
    "sortDate": "2025-07-08T12:00:00.000Z",
    "summary": "",
    "link": "https://www.genevaassociation.org/news/geneva-papers-risk-and-insurance-achieves-record-journal-impact-factor-33"
  },
  {
    "source": "Geneva Association News",
    "title": "2025 Geneva Association Ernst Meyer Prize awarded to works that help  insurers navigate today’s complex  global risk landscape",
    "date": "Jun 19, 2025",
    "sortDate": "2025-06-19T12:00:00.000Z",
    "summary": "",
    "link": "https://www.genevaassociation.org/press-releases/2025-geneva-association-ernst-meyer-prize-awarded-works-help-insurers-navigate"
  },
  {
    "source": "Geneva Association News",
    "title": "Safeguarding Home Insurance | Key messages",
    "date": "May 16, 2025",
    "sortDate": "2025-05-16T12:00:00.000Z",
    "summary": "",
    "link": "https://www.genevaassociation.org/videos/safeguarding-home-insurance-key-messages"
  },
  {
    "source": "Insurance Europe News",
    "title": "Investing for Europe’s future — the insurers’ perspective",
    "date": "3-11-2025",
    "sortDate": "2025-03-11T12:00:00.000Z",
    "summary": "",
    "link": "https://www.insuranceeurope.eu/news/3466/investing-for-europe-s-future-the-insurers-perspective"
  },
  {
    "source": "Geneva Association News",
    "title": "Insurance and the Longevity Economy | Key messages",
    "date": "Feb 19, 2025",
    "sortDate": "2025-02-19T12:00:00.000Z",
    "summary": "",
    "link": "https://www.genevaassociation.org/videos/insurance-and-longevity-economy-key-messages"
  },
  {
    "source": "Geneva Association News",
    "title": "Introducing Our Logo Transformation",
    "date": "Jan 16, 2025",
    "sortDate": "2025-01-16T12:00:00.000Z",
    "summary": "",
    "link": "https://www.genevaassociation.org/videos/introducing-our-logo-transformation"
  }
]